{
  "$schema": "../protocol/v1/client-capabilities.schema.json",
  "protocolMajor": 1,
  "features": ["command-id-v1", "session-stream-v1"],
  "gameContracts": ["counter/v1/sha256:8029f5f7709e239aab1c66f84ec0941c1e4da628e9896f71c75a44249f98f915"],
  "client": {
    "name": "eigen-example",
    "version": "1.0.0-dev",
    "platform": "test"
  }
}
